{
  "provenance_contract": "source-to-payload-v3",
  "boot_id": "11111111-2222-3333-4444-555555555555",
  "captured_utc": "2026-07-29T12:00:00Z",
  "xorg": {
    "package": "xorg-server 21.1.24-1.5",
    "xorg_binary_sha256": "aaaaaaaaaaaaaaaaaaaaaaaaaaaaaaaaaaaaaaaaaaaaaaaaaaaaaaaaaaaaaaaa",
    "xorg_build_id": "1111111111111111111111111111111111111111",
    "glamor_sha256": "bbbbbbbbbbbbbbbbbbbbbbbbbbbbbbbbbbbbbbbbbbbbbbbbbbbbbbbbbbbbbbbb",
    "glamor_build_id": "2222222222222222222222222222222222222222",
    "active_ddx": "radeon",
    "ddx_module_sha256": "cccccccccccccccccccccccccccccccccccccccccccccccccccccccccccccccc",
    "ddx_module_build_id": "3333333333333333333333333333333333333333",
    "ddx_package": "xf86-video-ati 1:22.0.0-1",
    "glamor_initialized": true,
    "server_provenance": {
      "source_repository": "xserver-rs48x",
      "source_commit": "4444444444444444444444444444444444444444",
      "source_tree": "5555555555555555555555555555555555555555",
      "release_repository": "PKGBUILD_xorg-server-glamor-r300fix",
      "release_commit": "6666666666666666666666666666666666666666",
      "release_input_sha256": "dddddddddddddddddddddddddddddddddddddddddddddddddddddddddddddddd",
      "package_artifact_sha256": "eeeeeeeeeeeeeeeeeeeeeeeeeeeeeeeeeeeeeeeeeeeeeeeeeeeeeeeeeeeeeeee",
      "installed_payload_manifest_sha256": "ffffffffffffffffffffffffffffffffffffffffffffffffffffffffffffffff"
    },
    "radeon_ddx_provenance": {
      "source_repository": "xf86-video-ati-rs485m",
      "source_commit": "7777777777777777777777777777777777777777",
      "source_tree": "8888888888888888888888888888888888888888",
      "release_repository": "PKGBUILD_xf86-video-ati-rs485m",
      "release_commit": "9999999999999999999999999999999999999999",
      "release_input_sha256": "1111111111111111111111111111111111111111111111111111111111111111",
      "package_artifact_sha256": "2222222222222222222222222222222222222222222222222222222222222222",
      "installed_payload_manifest_sha256": "3333333333333333333333333333333333333333333333333333333333333333"
    }
  },
  "mesa": {
    "source_sha": "aaaaaaaaaaaaaaaaaaaaaaaaaaaaaaaaaaaaaaaa",
    "libgallium_path": "/opt/mesa-rs482-profile-4/lib/libgallium.so",
    "libgallium_sha256": "4444444444444444444444444444444444444444444444444444444444444444",
    "libgallium_build_id": "bbbbbbbbbbbbbbbbbbbbbbbbbbbbbbbbbbbbbbbb",
    "prefix": "/opt/mesa-rs482-profile-4",
    "profile": "4_r300_full_release_x86_64v1-clang22-distcc-cache",
    "provenance": {
      "source_repository": "mesa-26-gororoba",
      "source_tree": "cccccccccccccccccccccccccccccccccccccccc",
      "build_manifest_sha256": "5555555555555555555555555555555555555555555555555555555555555555",
      "immutable_image_manifest_sha256": "6666666666666666666666666666666666666666666666666666666666666666",
      "installed_payload_manifest_sha256": "7777777777777777777777777777777777777777777777777777777777777777"
    }
  },
  "kernel": {
    "kernel_release": "6.18.0-rs482",
    "radeon_package": "radeon-unified-dkms 0.3-93",
    "radeon_srcversion": "BBBBBBBBBBBBBBBBBBBBBBBBBBBBBBBB",
    "provenance": {
      "source_repository": "linux-radeon-gororoba",
      "source_commit": "dddddddddddddddddddddddddddddddddddddddd",
      "source_tree": "eeeeeeeeeeeeeeeeeeeeeeeeeeeeeeeeeeeeeeee",
      "source_pin_sha256": "8888888888888888888888888888888888888888888888888888888888888888",
      "source_archive_sha256": "9999999999999999999999999999999999999999999999999999999999999999",
      "release_repository": "radeon-custom",
      "release_commit": "ffffffffffffffffffffffffffffffffffffffff",
      "package_artifact_sha256": "aaaaaaaaaaaaaaaaaaaaaaaaaaaaaaaaaaaaaaaaaaaaaaaaaaaaaaaaaaaaaaaa",
      "installed_payload_manifest_sha256": "bbbbbbbbbbbbbbbbbbbbbbbbbbbbbbbbbbbbbbbbbbbbbbbbbbbbbbbbbbbbbbbb",
      "module_sha256": "cccccccccccccccccccccccccccccccccccccccccccccccccccccccccccccccc",
      "module_build_id": "2222222222222222222222222222222222222222",
      "equivalence": {
        "migration_input_sha256": "dddddddddddddddddddddddddddddddddddddddddddddddddddddddddddddddd",
        "normalization_tool_sha256": "eeeeeeeeeeeeeeeeeeeeeeeeeeeeeeeeeeeeeeeeeeeeeeeeeeeeeeeeeeeeeeee",
        "source_export_tool_sha256": "ffffffffffffffffffffffffffffffffffffffffffffffffffffffffffffffff",
        "generator_source_sha256": "1111111111111111111111111111111111111111111111111111111111111111",
        "generator_binary_sha256": "2222222222222222222222222222222222222222222222222222222222222222",
        "normalized_source_manifest_sha256": "3333333333333333333333333333333333333333333333333333333333333333",
        "normalization_record_sha256": "4444444444444444444444444444444444444444444444444444444444444444",
        "source_export_manifest_sha256": "5555555555555555555555555555555555555555555555555555555555555555",
        "source_comparison_sha256": "6666666666666666666666666666666666666666666666666666666666666666",
        "generated_output_proof_sha256": "7777777777777777777777777777777777777777777777777777777777777777",
        "generated_output_comparison_sha256": "8888888888888888888888888888888888888888888888888888888888888888",
        "machine_record_sha256": "9999999999999999999999999999999999999999999999999999999999999999"
      }
    }
  },
  "evidence": {
    "stein_sha": "1111111111111111111111111111111111111111",
    "runner_sha256": "aaaaaaaaaaaaaaaaaaaaaaaaaaaaaaaaaaaaaaaaaaaaaaaaaaaaaaaaaaaaaaaa",
    "trigger_sha256": "bbbbbbbbbbbbbbbbbbbbbbbbbbbbbbbbbbbbbbbbbbbbbbbbbbbbbbbbbbbbbbbb"
  }
}
